{
  "$schema": "../../../../schemas/discovery/v1/coverage-ledger.schema.json",
  "entries": [
    {
      "status": "not_started",
      "unit_id": "placeholder-unit",
      "unit_kind": "module"
    }
  ],
  "generated_at": "1970-01-01T00:00:00Z",
  "id": "placeholder-coverage-ledger",
  "schema_version": "1.0.0",
  "subject": "Placeholder covered-corpus label",
  "summary": {
    "covered_units": 0,
    "total_units": 0
  }
}
